{
  "$schema": "./schema/config.schema.json",
  "edition": "中华书局点校本",
  "firstEditor": "chengs",
  "roots": {
    "books": "books",
    "people": "people",
    "articles": "articles",
    "graph": "graph"
  },
  "personRoles": ["史家", "纪传人物"],
  "bookGroups": [
    { "id": "前四史", "label": "前四史", "caption": "史汉后汉三国，纪传体的典范" },
    { "id": "晋与南北朝", "label": "晋与南北朝", "caption": "分裂时代的专史" },
    { "id": "南北史与隋", "label": "南北史与隋", "caption": "通贯与制度总账" },
    { "id": "唐与五代", "label": "唐与五代", "caption": "新旧两书对读" },
    { "id": "宋辽金元明", "label": "宋辽金元明", "caption": "多民族王朝的正史" }
  ],
  "dynastyOrder": [
    "上古",
    "夏",
    "商",
    "西周",
    "春秋",
    "战国",
    "秦",
    "秦末",
    "西汉",
    "新",
    "东汉",
    "曹魏",
    "蜀汉",
    "孙吴",
    "西晋",
    "东晋",
    "十六国",
    "南朝宋",
    "南朝齐",
    "南朝梁",
    "南朝陈",
    "北魏",
    "北齐",
    "北周",
    "隋",
    "唐",
    "五代",
    "十国",
    "北宋",
    "南宋",
    "辽",
    "金",
    "元",
    "明",
    "清"
  ],
  "claimTypes": [
    "杀",
    "诛",
    "封",
    "徙封",
    "拜",
    "迁",
    "谏",
    "计",
    "叛",
    "降",
    "盟",
    "约",
    "败",
    "破",
    "亲属",
    "隶属"
  ],
  "juanTypes": ["纪", "表", "书", "志", "世家", "列传"],
  "layers": ["正文", "注", "互证"],
  "pathStatuses": ["extracting", "planned"],
  "claimStatuses": ["draft", "published", "qualified", "disputed", "legend"],
  "bookSlugAliases": {
    "shiji": "shi-ji",
    "hanshu": "han-shu",
    "houhanshu": "hou-hanshu",
    "sanguozhi": "sanguo-zhi",
    "jinshu": "jin-shu",
    "songshu": "song-shu",
    "nanqishu": "nan-qi-shu",
    "liangshu": "liang-shu",
    "chenshu": "chen-shu",
    "weishu": "wei-shu",
    "beiqishu": "bei-qi-shu",
    "zhoushu": "zhou-shu",
    "suishu": "sui-shu",
    "nanshi": "nan-shi",
    "beishi": "bei-shi",
    "jiutangshu": "jiu-tang-shu",
    "xintangshu": "xin-tang-shu",
    "jiuwudaishi": "jiu-wu-dai-shi",
    "xinwudaishi": "xin-wu-dai-shi",
    "songshi": "song-shi",
    "liaoshi": "liao-shi",
    "jinshi": "jin-shi",
    "yuanshi": "yuan-shi",
    "mingshi": "ming-shi"
  },
  "writtenStart": {
    "shi-ji": -104,
    "han-shu": 62,
    "sanguo-zhi": 280,
    "hou-hanshu": 432,
    "song-shu": 487,
    "nan-qi-shu": 510,
    "wei-shu": 551,
    "liang-shu": 629,
    "chen-shu": 629,
    "bei-qi-shu": 629,
    "zhou-shu": 629,
    "sui-shu": 629,
    "jin-shu": 644,
    "nan-shi": 650,
    "bei-shi": 650,
    "jiu-tang-shu": 941,
    "jiu-wu-dai-shi": 973,
    "xin-wu-dai-shi": 1036,
    "xin-tang-shu": 1044,
    "liao-shi": 1343,
    "jin-shi": 1343,
    "song-shi": 1343,
    "yuan-shi": 1369,
    "ming-shi": 1645
  },
  "compiledYear": {
    "shi-ji": -91,
    "han-shu": 80,
    "hou-hanshu": 445,
    "sanguo-zhi": 280,
    "jin-shu": 646,
    "song-shu": 487,
    "nan-qi-shu": 520,
    "liang-shu": 636,
    "chen-shu": 636,
    "wei-shu": 554,
    "bei-qi-shu": 636,
    "zhou-shu": 636,
    "sui-shu": 636,
    "nan-shi": 659,
    "bei-shi": 659,
    "jiu-tang-shu": 945,
    "xin-tang-shu": 1060,
    "jiu-wu-dai-shi": 974,
    "xin-wu-dai-shi": 1053,
    "song-shi": 1345,
    "liao-shi": 1344,
    "jin-shi": 1344,
    "yuan-shi": 1370,
    "ming-shi": 1739
  }
}
